<?xml version="1.0" encoding="UTF-8"?>
<!ELEMENT movie-info (movie+)>
<!ELEMENT movie (id, title, release-date, theatre+)>
<!ELEMENT id (#PCDATA)>
<!ELEMENT title (#PCDATA)>
<!ELEMENT release-date (day, month, year)>
<!ELEMENT day (#PCDATA)>
<!ELEMENT month (#PCDATA)>
<!ELEMENT year (#PCDATA)>
<!ELEMENT theatre (#PCDATA)>